{
  "id": "ok-panel",
  "name": { "zh-TW": "面板正常測試", "en-US": "OK Panel Fixture" },
  "version": "1.0.0",
  "apiVersion": "1",
  "author": "Agent Pets Test Fixtures",
  "entry": "dist/main.js",
  "icon": "assets/icon.png",
  "permissions": { "storage": true },
  "contributes": {
    "panelView": {
      "entry": "ui/index.html",
      "title": { "zh-TW": "正常面板", "en-US": "Working panel" },
      "preferredSize": { "width": 520, "height": 440 }
    }
  }
}
