{
  "id": "ok-notify",
  "name": { "zh-TW": "正常通知測試插件", "en-US": "OK Notify Fixture" },
  "version": "1.0.0",
  "apiVersion": "1",
  "author": "Agent Pets Test Fixtures",
  "entry": "dist/main.js",
  "icon": "assets/icon.png",
  "permissions": { "storage": true },
  "contributes": { "feed": true }
}
