{
  "id": "evil-panel",
  "name": { "zh-TW": "惡意面板測試", "en-US": "Evil Panel Fixture" },
  "version": "1.0.0",
  "apiVersion": "1",
  "author": "Agent Pets Test Fixtures",
  "entry": "dist/main.js",
  "icon": "assets/icon.png",
  "permissions": {},
  "contributes": {
    "panelView": {
      "entry": "ui/index.html",
      "title": { "zh-TW": "惡意面板測試", "en-US": "Evil panel test" },
      "preferredSize": { "width": 520, "height": 440 }
    }
  }
}
