{
  "id": "evil-escape",
  "name": {
    "zh-TW": "隔離逃逸探測",
    "en-US": "Isolation Escape Probe"
  },
  "version": "1.0.0",
  "apiVersion": "1",
  "author": "Agent Pets Security Tests",
  "entry": "dist/main.js",
  "icon": "assets/icon.png",
  "permissions": {
    "storage": true
  },
  "contributes": {
    "feed": true
  }
}
